  {
    "shipmentNumber": 899561,
    "action": "",
    "transportationMode": "",
    "pickupDateBegin": "10/23/2019 8:00",
    "pickupDateEnd": "10/23/2019 17:00",
    "deliveryDateBegin": "",
    "deliveryDateEnd": "",
    "originName": "AP Exhaust Technologies, Inc",
    "originAddress1": "300 Dixie Trail",
    "originAddress2": "",
    "originCity": "Goldsboro",
    "originState": "NC",
    "originZip": "27530-7198",
    "originCountry": "USA",
    "originPhone": "919-580-2000",
    "originFax": "",
    "originEmail": "",
    "originContactName": "",
    "originEarliestAppointmentTime": "",
    "originLatestAppointmentTime": "",
    "destinationName": "TEAM ALLIED DISTRIBUTION",
    "destinationAddress1": "1222 QUEBEC ST",
    "destinationAddress2": "",
    "destinationCity": "N KANSAS CITY",
    "destinationState": "MO",
    "destinationZip": "64116",
    "destinationCountry": "US",
    "destinationPhone": "",
    "destinationFax": "",
    "destinationEmail": "",
    "destinationContactName": "",
    "destinationEarliestAppointmentTime": "",
    "destinationLatestAppointmentTime": "",
    "buyerName": "",
    "customerId": 1434,
    "customerRemit": 0,
    "shipmentProcessingIdentifier": "",
    "specialInstructions": "",
    "partNumber": "",
    "partDescription": "Auto Parts",
    "freightClass": 60,
    "monetaryValue": "",
    "shippingQuantity": "",
    "shippingWeightTotal": 6974,
    "shippingPackaging": "",
    "shippingItemLength": "",
    "shippingItemWidth": "",
    "shippingItemHeight": "",
    "shippingItemTotalCube": "",
    "services": "",
    "referenceType#1": "Account Number",
    "referenceValue#1": 942063,
    "referenceType#2": "Cadence Customer",
    "referenceValue#2": "",
    "referenceType#3": "Sales Amount",
    "referenceValue#3": 10612.44,
    "referenceType#4": "Customer Ship ID",
    "referenceValue#4": 899561,
    "referenceType#5": "Tube Weight",
    "referenceValue#5": 4884,
    "referenceType#6": "Load Number",
    "referenceValue#6": "T-102219-16",
    "referenceType#7": "Direction",
    "referenceValue#7": "outbound",
    "referenceType#8": "",
    "referenceValue#8": "",
    "referenceType#9": "",
    "referenceValue#9": "",
    "referenceType#10": "",
    "referenceValue#10": "",
    "referenceType#11": "",
    "referenceValue#11": "",
    "referenceType#12": "",
    "referenceValue#12": "",
    "referenceType#13": "",
    "referenceValue#13": "",
    "referenceType#14": "",
    "referenceValue#14": "",
    "referenceType#15": "",
    "referenceValue#15": "",
    "referenceType#16": "",
    "referenceValue#16": ""
  }